{
  "version": 1,
  "time_unit": "seconds",
  "meta": {
    "name": "图片叠加",
    "fps": 30.0,
    "width": 540,
    "height": 960,
    "duration": 3.0
  },
  "tracks": [
    {
      "id": "V1",
      "name": "V1 主视频",
      "kind": "video"
    },
    {
      "id": "V3",
      "name": "V3 图片/Overlay",
      "kind": "video"
    }
  ],
  "elements": [
    {
      "id": "clip_001",
      "type": "video",
      "track": "V1",
      "asset": "demo",
      "start": 0.0,
      "duration": 3.0,
      "source": {
        "start": 0.0,
        "end": 3.0
      }
    },
    {
      "id": "overlay_001",
      "type": "overlay",
      "track": "V3",
      "asset": "arrow_red",
      "start": 0.5,
      "duration": 1.5,
      "transform": {
        "x": 0.35,
        "y": 0.4,
        "scale": 0.6
      }
    }
  ]
}